{
  "$schema": "https://json-schema.org/draft/2020-12/schema",
  "$id": "urn:bharat-last-mile-id:schema:participant-metadata:1.0",
  "title": "Bharat Last-Mile ID Participant Metadata for Levels 1 and 2",
  "description": "Machine-discoverable capabilities, public keys, and optional event receiver information for an LMID participant domain.",
  "type": "object",
  "additionalProperties": false,
  "required": ["domain", "display_name", "roles", "jwks_uri", "versions_supported"],
  "properties": {
    "domain": {
      "description": "Canonical bare domain that owns this metadata document and identifies the LMID participant.",
      "type": "string",
      "minLength": 3,
      "maxLength": 253,
      "pattern": "^(?=.{1,253}$)(?:[a-z0-9](?:[a-z0-9-]{0,61}[a-z0-9])?\\.)+[a-z](?:[a-z0-9-]{0,61}[a-z0-9])?$"
    },
    "display_name": {
      "description": "Participant-controlled public display name shown together with the canonical domain.",
      "type": "string",
      "minLength": 1,
      "maxLength": 128,
      "pattern": "^(?!\\s)(?!.*\\s$)(?!.*[\\u0000-\\u001F\\u007F-\\u009F\\u2028\\u2029\\u202A-\\u202E\\u2066-\\u2069]).+$"
    },
    "roles": {
      "description": "LMID protocol roles performed by this participant.",
      "type": "array",
      "minItems": 1,
      "maxItems": 2,
      "uniqueItems": true,
      "items": { "enum": ["issuer", "verifier"] }
    },
    "jwks_uri": {
      "description": "HTTPS URI of the participant's public LMID JWK Set for pass and HTTP message signature verification.",
      "type": "string",
      "format": "uri",
      "pattern": "^https://",
      "maxLength": 512
    },
    "versions_supported": {
      "description": "LMID wire-format versions supported by the participant, separate from capability levels. Level 2 event support is advertised through event_receiver.",
      "type": "array",
      "minItems": 1,
      "uniqueItems": true,
      "items": { "type": "integer", "minimum": 1 }
    },
    "token_types_supported": {
      "description": "Explicit JWS typ values emitted by the participant when it acts as a pass issuer.",
      "type": "array",
      "minItems": 1,
      "uniqueItems": true,
      "items": { "type": "string", "minLength": 1, "maxLength": 64 }
    },
    "photo_origins": {
      "description": "Additional HTTPS origins from which a reader may retrieve holder photographs referenced by this participant's passes.",
      "type": "array",
      "maxItems": 16,
      "uniqueItems": true,
      "items": { "type": "string", "format": "uri", "pattern": "^https://", "maxLength": 512 }
    },
    "event_receiver": {
      "description": "Optional Level 2 HTTPS receiver and event types accepted by this participant.",
      "$ref": "#/$defs/eventReceiver"
    }
  },
  "allOf": [
    {
      "if": {
        "properties": {
          "roles": {
            "description": "Detects metadata claiming the issuer role.",
            "type": "array",
            "contains": { "const": "issuer" }
          }
        },
        "required": ["roles"]
      },
      "then": {
        "required": ["token_types_supported"],
        "properties": {
          "token_types_supported": {
            "description": "Requires an issuer to advertise the LMID pass token type.",
            "type": "array",
            "contains": { "const": "lmid+jwt" }
          }
        }
      }
    }
  ],
  "$defs": {
    "eventReceiver": {
      "type": "object",
      "additionalProperties": false,
      "required": ["uri", "types_supported"],
      "properties": {
        "uri": {
          "description": "HTTPS endpoint that accepts signed LMID CloudEvents by HTTP POST.",
          "type": "string",
          "format": "uri",
          "pattern": "^https://",
          "maxLength": 512
        },
        "types_supported": {
          "description": "LMID event type strings accepted by the receiver.",
          "type": "array",
          "minItems": 1,
          "uniqueItems": true,
          "items": { "enum": ["gate_check_in"] }
        }
      }
    }
  }
}
